{
    "gui": {
        "pyqtmaxplots": 20,
        "notebook": true,
        "plotlib": "all"
    },
    "core": {
        "default_fmt": "data/{date}/#{counter}_{name}_{time}",
        "loglevel": "WARNING"
    },
    "user": {
        "scriptfolder": "/Users/natalie/Documents/PhD/Qdev/QcodesRelated/QcodesExperiments/ExperimentScripts",
        "mainfolder": "/Users/natalie/Documents/PhD/Qdev/QcodesRelated/QcodesExperiments/Qcodes_test_data"
    },
    "station_configurator": {
        "enable_forced_reconnect": false,
        "default_folder": "C:\\Users\\a-dovoge\\repos\\qdev-wrappers\\examples\\station_configurator",
        "default_file": "testSetupConfig.yaml"
    }
}
